{
  "$schema": "https://json-schema.org/draft/2020-12/schema",
  "$id": "baseline/v6/contracts/data_snapshot.schema.v6.json",
  "title": "Financial Agent Benchmark data_snapshot (baseline v6)",
  "description": "Append-only v6 successor preserving v4 snapshot semantics while the v6 registry binds case and variant identities to exact frozen input artifacts.",
  "type": "object",
  "required": [
    "contract_type",
    "contract_version",
    "snapshot_id",
    "revision",
    "status",
    "source",
    "access",
    "financial_subject",
    "temporal",
    "records",
    "lineage",
    "integrity"
  ],
  "properties": {
    "contract_type": { "const": "data_snapshot" },
    "contract_version": { "const": "6.0.0" },
    "snapshot_id": { "type": "string", "minLength": 1 },
    "revision": { "type": "integer", "minimum": 1 },
    "status": { "const": "frozen" },
    "source": {
      "type": "object",
      "required": ["provider", "source_type", "dataset", "uri", "license"],
      "properties": {
        "provider": { "type": "string", "minLength": 1 },
        "source_type": {
          "enum": ["market_data", "filing", "announcement", "fundamentals", "valuation", "macro", "corporate_action", "benchmark", "synthetic_fixture"]
        },
        "dataset": { "type": "string", "minLength": 1 },
        "uri": { "type": "string", "minLength": 1 },
        "license": { "$ref": "#/$defs/license" }
      },
      "additionalProperties": false
    },
    "access": {
      "type": "object",
      "required": ["mode", "query_name", "query_args", "prohibited_scopes"],
      "properties": {
        "mode": { "const": "public_read_only" },
        "query_name": { "type": "string", "minLength": 1 },
        "query_args": { "type": "object" },
        "prohibited_scopes": {
          "type": "array",
          "uniqueItems": true,
          "items": { "enum": ["account", "assets", "cash", "holdings", "orders", "positions", "portfolio", "trades"] }
        }
      },
      "additionalProperties": false
    },
    "financial_subject": { "$ref": "case_card.schema.v6.json#/$defs/financial_subject" },
    "temporal": {
      "type": "object",
      "required": ["event_time", "as_of", "available_at", "retrieved_at"],
      "properties": {
        "event_time": { "$ref": "#/$defs/timestamp" },
        "as_of": { "$ref": "#/$defs/timestamp" },
        "available_at": { "$ref": "#/$defs/timestamp" },
        "retrieved_at": { "$ref": "#/$defs/timestamp" }
      },
      "additionalProperties": false
    },
    "records": {
      "type": "array",
      "items": {
        "type": "object",
        "required": ["record_id", "evidence_type", "source_locator", "payload"],
        "properties": {
          "record_id": { "type": "string", "minLength": 1 },
          "evidence_type": { "type": "string", "minLength": 1 },
          "source_locator": { "type": "string", "minLength": 1 },
          "payload": { "type": "object" },
          "event_time": { "$ref": "#/$defs/timestamp" },
          "available_at": { "$ref": "#/$defs/timestamp" }
        },
        "additionalProperties": false
      }
    },
    "lineage": {
      "type": "object",
      "required": ["collector", "collector_version", "schema_version", "query_args", "raw_response_sha256", "code_revision", "parent_snapshot_ids"],
      "properties": {
        "collector": { "type": "string", "minLength": 1 },
        "collector_version": { "type": "string", "minLength": 1 },
        "schema_version": { "type": "string", "minLength": 1 },
        "query_args": { "type": "object" },
        "raw_response_sha256": { "$ref": "#/$defs/sha256" },
        "code_revision": { "type": "string", "minLength": 1 },
        "parent_snapshot_ids": { "type": "array", "items": { "type": "string" } },
        "notes": { "type": "string" }
      },
      "additionalProperties": false
    },
    "integrity": { "$ref": "case_card.schema.v6.json#/$defs/integrity" }
  },
  "additionalProperties": false,
  "$defs": {
    "timestamp": { "type": "string", "pattern": "^\\d{4}-\\d{2}-\\d{2}T\\d{2}:\\d{2}:\\d{2}(\\.\\d+)?Z$" },
    "sha256": { "type": "string", "pattern": "^[0-9a-f]{64}$" },
    "license": {
      "type": "object",
      "required": ["name", "url", "redistributable"],
      "properties": {
        "name": { "type": "string", "minLength": 1 },
        "url": { "type": "string", "format": "uri" },
        "redistributable": { "type": "boolean" }
      },
      "additionalProperties": false
    }
  },
  "supersedes": {
    "path": "baseline/v5/contracts/data_snapshot.schema.v5.json",
    "sha256": "15a1a540de495a2d8746c6d2e444485c862eebc518125e90229a9db1b21a8b7d",
    "reason": "PER-330 fourth audit: v6 preserves data semantics and leaves v5 unchanged as historical failure evidence."
  }
}
