{
  "access": {
    "mode": "public_read_only",
    "prohibited_scopes": [
      "account",
      "assets",
      "cash",
      "holdings",
      "orders",
      "positions",
      "portfolio",
      "trades"
    ],
    "query_args": {
      "cik": "CIK0000320193",
      "tag": "RevenueFromContractWithCustomerExcludingAssessedTax",
      "taxonomy": "us-gaap"
    },
    "query_name": "xbrl_company_concept"
  },
  "contract_type": "data_snapshot",
  "contract_version": "6.0.0",
  "financial_subject": {
    "currency": {
      "code": "USD"
    },
    "entity_name": "Apple Inc.",
    "identifiers": [
      {
        "scheme": "SEC_CIK",
        "value": "CIK0000320193"
      },
      {
        "scheme": "US_GAAP_TAG",
        "value": "RevenueFromContractWithCustomerExcludingAssessedTax"
      }
    ],
    "market": {
      "country": "US",
      "mic": "XXXX",
      "timezone": "UTC"
    },
    "subject_type": "accounting_concept",
    "units": {
      "accounting_basis": "US GAAP, as filed in the referenced 10-K",
      "amount_scale": "USD unit (as filed)",
      "price_basis": "not_applicable"
    }
  },
  "integrity": {
    "canonicalization": "financial-agent-c14n-json-v1",
    "content_sha256": "632395eea02e08d2c9ec79a3ae28eb41c133e633ef382e532fd263737d4ad0f0",
    "hash_algorithm": "sha256"
  },
  "lineage": {
    "code_revision": "cbdfb99e43618d5866ce158a7a9843e4893f810c",
    "collector": "manual public SEC EDGAR retrieval with declared User-Agent",
    "collector_version": "1.0.0",
    "notes": "missing_or_anomalous derivative: all records removed to evaluate correct abstention; Silver only, never ranking-eligible.",
    "parent_snapshot_ids": [
      "snapshot-sec-edgar-aapl-revenue-v6-01"
    ],
    "query_args": {
      "cik": "CIK0000320193",
      "tag": "RevenueFromContractWithCustomerExcludingAssessedTax",
      "taxonomy": "us-gaap"
    },
    "raw_response_sha256": "4495f7a16b4ade43dfa8041ac6477074122cbd5b88033e3e0f68b3f919e7ffbf",
    "schema_version": "case-data/4.0.0"
  },
  "records": [],
  "revision": 1,
  "snapshot_id": "snapshot-sec-edgar-aapl-revenue-v6-01-missing",
  "source": {
    "dataset": "SEC EDGAR XBRL company concept, Apple Inc. (CIK0000320193), RevenueFromContractWithCustomerExcludingAssessedTax",
    "license": {
      "name": "US public domain (SEC EDGAR government data)",
      "redistributable": true,
      "url": "https://www.sec.gov/edgar"
    },
    "provider": "sec_edgar",
    "source_type": "filing",
    "uri": "https://data.sec.gov/api/xbrl/companyconcept/CIK0000320193/us-gaap/RevenueFromContractWithCustomerExcludingAssessedTax.json"
  },
  "status": "frozen",
  "temporal": {
    "as_of": "2024-09-28T00:00:00Z",
    "available_at": "2024-11-01T00:00:00Z",
    "event_time": "2024-09-28T00:00:00Z",
    "retrieved_at": "2026-08-17T10:36:18Z"
  }
}
